{
  "scenario_id": "V4L09B-pre-pr-review",
  "findings": {
    "correctness-cache": [
      {
        "anchor_source_id": "B-CARD-101",
        "file": "cache/store.py",
        "symbol": "Cache.get",
        "severity": "high"
      }
    ],
    "reliability-retry": [
      {
        "anchor_source_id": "B-CARD-201",
        "file": "workers/retry.py",
        "symbol": "RetryWorker.run",
        "severity": "medium"
      }
    ],
    "performance-query": [
      {
        "anchor_source_id": "B-CARD-301",
        "file": "items/repository.py",
        "symbol": "list_items",
        "severity": "medium"
      }
    ],
    "security-token": []
  },
  "evidence": {
    "bindings": {
      "B-CARD-101": {
        "source_ids": [
          "B-CARD-101",
          "B-CARD-102"
        ]
      },
      "B-CARD-201": {
        "source_ids": [
          "B-CARD-201",
          "B-CARD-202"
        ]
      },
      "B-CARD-301": {
        "source_ids": [
          "B-CARD-301",
          "B-CARD-302"
        ]
      }
    }
  },
  "non_findings": [],
  "review_scope": [
    "cache/store.py",
    "workers/retry.py",
    "items/repository.py",
    "auth/token.py"
  ],
  "rejected_sources": [
    "B-CARD-501",
    "B-CARD-502",
    "B-CARD-601",
    "B-CARD-602"
  ],
  "review_gate": {
    "merge_clearance": "needs-review"
  },
  "actions": {
    "B-CARD-101": {
      "outcome": "fix-before-merge"
    },
    "B-CARD-201": {
      "outcome": "add-regression-test"
    },
    "B-CARD-301": {
      "outcome": "optimize-before-merge"
    },
    "B-CARD-401": {
      "outcome": "block-merge"
    }
  }
}
